code,title,description,primaryResp,seconderyResp,estimateDuration
1,Project,Overall project scope and goals,PM,,30d
1.1,Initiation,Decide scope and stakeholders,PM,,2d
1.1.1,Project Charter,Create and approve the charter,PM,,1d
1.1.2,Stakeholder Register,List and analyze stakeholders,PM,,1d
1.2,Planning,Plan requirements and architecture,SE,PM,6d
1.2.1,Requirements,Collect and structure requirements,SE,PM,3d
1.2.2,Architecture,Design system structure,SE,,5d
1.3,Execution,Develop features and integrate,Dev,SE,11d
1.3.1,Module A,Implement module A,Dev,,6d
1.3.2,Module B,Implement module B,Dev,,8d
1.3.3,Integration,Integrate A and B,Dev,SE,5d
1.4,Testing,Test modules and system,QA,SE,5d
1.4.1,Unit Tests,Write and run unit tests,QA,,3d
1.4.2,Integration Tests,Run integration tests,QA,SE,3d
1.5,Closeout,Close the project formally,PM,,2d